{
  "schemaVersion": "1.0.0",
  "generatedAt": "2026-08-05T12:29:33.366Z",
  "toolchains": {
    "clang": "clang --target=wasm32 -O3 -nostdlib",
    "clangpp": "clang++ --target=wasm32 -O3 -nostdlib",
    "assemblyscript": "asc -O3 --bindings none --noAssert",
    "rustc": "rustc --target wasm32-unknown-unknown -O --crate-type cdylib",
    "dart2wasm": "dart compile wasm (dart2wasm, WasmGC)",
    "kotlinWasm": "prebuilt Kotlin 2.3.21 / Wasm (text-gc-document-edit)"
  },
  "workloads": [
    {
      "name": "sum-u32",
      "description": "Array sum reduction over 1,000 u32 integers across 200,000 warm iterations. Dart consumes the same data as a zero-copy Uint32Array via dart:js_interop.",
      "variants": [
        {
          "language": "JavaScript",
          "toolchain": "V8 JIT Engine",
          "binarySizeBytes": 0,
          "coldInstantiateMs": 0,
          "warmExecutionMs": 86.26,
          "memoryPageCount": 0,
          "importsCount": 0,
          "exportsCount": 1,
          "notes": "Pure JS baseline; fast JIT loop optimization."
        },
        {
          "language": "Raw WAT",
          "toolchain": "Handwritten WAT / Bytecode",
          "binarySizeBytes": 96,
          "coldInstantiateMs": 0.0013,
          "warmExecutionMs": 53.02,
          "memoryPageCount": 1,
          "importsCount": 0,
          "exportsCount": 2,
          "notes": "Direct opcode stream; zero runtime glue or memory manager."
        },
        {
          "language": "AssemblyScript",
          "toolchain": "AssemblyScript compiler (asc -O3)",
          "binarySizeBytes": 94,
          "coldInstantiateMs": 0.001,
          "warmExecutionMs": 53.1,
          "memoryPageCount": 1,
          "importsCount": 0,
          "exportsCount": 2,
          "notes": "TypeScript-like syntax compiled to linear-memory Wasm."
        },
        {
          "language": "C / Wasm",
          "toolchain": "LLVM Clang (-O3 -nostdlib)",
          "binarySizeBytes": 757,
          "coldInstantiateMs": 0.0018,
          "warmExecutionMs": 40.37,
          "memoryPageCount": 1,
          "importsCount": 0,
          "exportsCount": 14,
          "notes": "Standalone Clang compilation; exposes low-level memory export symbols."
        },
        {
          "language": "C++ / Wasm",
          "toolchain": "LLVM Clang++ (-O3 -nostdlib)",
          "binarySizeBytes": 759,
          "coldInstantiateMs": 0.0017,
          "warmExecutionMs": 40.21,
          "memoryPageCount": 1,
          "importsCount": 0,
          "exportsCount": 14,
          "notes": "Standalone Clang++ compilation with extern 'C' export wrappers."
        },
        {
          "language": "Rust / Wasm",
          "toolchain": "rustc wasm32-unknown-unknown (-O cdylib)",
          "binarySizeBytes": 498,
          "coldInstantiateMs": 0.0011,
          "warmExecutionMs": 40.58,
          "memoryPageCount": 1,
          "importsCount": 0,
          "exportsCount": 2,
          "notes": "no_std cdylib; identical u32 reduction semantics to C."
        },
        {
          "language": "Dart / WasmGC",
          "toolchain": "dart compile wasm (dart2wasm, Dart 3.12.2)",
          "binarySizeBytes": 39613,
          "coldInstantiateMs": 0.0922,
          "warmExecutionMs": 149.01,
          "memoryPageCount": 2,
          "importsCount": 380,
          "exportsCount": 9,
          "notes": "WasmGC module; @JSExport kernels consume a zero-copy Uint32Array via dart:js_interop. Cold instantiation and warm execution measured with the dart2wasm-generated glue."
        }
      ]
    },
    {
      "name": "fft-kernel",
      "description": "Fast Fourier Transform butterfly kernel (512 float elements, 2,000 warm iterations). C/C++/AssemblyScript/Rust use an f32 polynomial sin/cos; JS and Dart use f64 Math.sin/cos — disclosed per-variant, no output cross-check across those families.",
      "variants": [
        {
          "language": "JavaScript",
          "toolchain": "V8 JIT Engine",
          "binarySizeBytes": 0,
          "coldInstantiateMs": 0,
          "warmExecutionMs": 37.59,
          "memoryPageCount": 0,
          "importsCount": 0,
          "exportsCount": 1,
          "notes": "Math.sin/cos loop (f64)."
        },
        {
          "language": "AssemblyScript",
          "toolchain": "AssemblyScript compiler (asc -O3)",
          "binarySizeBytes": 2479,
          "coldInstantiateMs": 0.0015,
          "warmExecutionMs": 8.4,
          "memoryPageCount": 1,
          "importsCount": 0,
          "exportsCount": 2,
          "notes": "Mathf intrinsics (f32)."
        },
        {
          "language": "C / Wasm",
          "toolchain": "LLVM Clang (-O3 -nostdlib)",
          "binarySizeBytes": 1149,
          "coldInstantiateMs": 0.0019,
          "warmExecutionMs": 8.05,
          "memoryPageCount": 1,
          "importsCount": 0,
          "exportsCount": 14,
          "notes": "f32 polynomial sin/cos (wasm32 has no hardware trig)."
        },
        {
          "language": "C++ / Wasm",
          "toolchain": "LLVM Clang++ (-O3 -nostdlib)",
          "binarySizeBytes": 1151,
          "coldInstantiateMs": 0.0018,
          "warmExecutionMs": 7.79,
          "memoryPageCount": 1,
          "importsCount": 0,
          "exportsCount": 14,
          "notes": "f32 polynomial sin/cos via extern 'C' wrappers."
        },
        {
          "language": "Rust / Wasm",
          "toolchain": "rustc wasm32-unknown-unknown (-O cdylib)",
          "binarySizeBytes": 889,
          "coldInstantiateMs": 0.0012,
          "warmExecutionMs": 7.86,
          "memoryPageCount": 1,
          "importsCount": 0,
          "exportsCount": 2,
          "notes": "no_std cdylib; mirrors the C f32 polynomial butterfly exactly."
        },
        {
          "language": "Dart / WasmGC",
          "toolchain": "dart compile wasm (dart2wasm, Dart 3.12.2)",
          "binarySizeBytes": 39613,
          "coldInstantiateMs": 0.0922,
          "warmExecutionMs": 53.92,
          "memoryPageCount": 2,
          "importsCount": 380,
          "exportsCount": 9,
          "notes": "WasmGC module; f64 dart:math sin/cos over zero-copy Float32Array views."
        }
      ]
    },
    {
      "name": "text-diff-patch",
      "description": "Myers O(ND) diff over interned line IDs with prefix/suffix trim and trace backtrack (reduced shape: 512-line base, 30 interleaved edits, 60 warm iterations). All variants are bit-identical to the JS myersDiff oracle (ops, editDistance, frontierSteps — test-verified). Dart/WasmGC uses typed-data working buffers on the managed heap.",
      "variants": [
        {
          "language": "JavaScript",
          "toolchain": "V8 JIT Engine (Int32Array v/trace)",
          "binarySizeBytes": 0,
          "coldInstantiateMs": 0,
          "warmExecutionMs": 3.15,
          "memoryPageCount": 0,
          "importsCount": 0,
          "exportsCount": 1,
          "notes": "Exact oracle semantics."
        },
        {
          "language": "C / Wasm",
          "toolchain": "LLVM Clang (-O3 -nostdlib)",
          "binarySizeBytes": 3077,
          "coldInstantiateMs": 0.002,
          "warmExecutionMs": 2.3,
          "memoryPageCount": 1,
          "importsCount": 0,
          "exportsCount": 2,
          "notes": "Linear memory; scratch v/trace buffer passed by the caller."
        },
        {
          "language": "C++ / Wasm",
          "toolchain": "LLVM Clang++ (-O3 -nostdlib)",
          "binarySizeBytes": 3079,
          "coldInstantiateMs": 0.0019,
          "warmExecutionMs": 2.02,
          "memoryPageCount": 1,
          "importsCount": 0,
          "exportsCount": 2,
          "notes": "Identical body to C in an extern \"C\" translation unit."
        },
        {
          "language": "Rust / Wasm",
          "toolchain": "rustc wasm32-unknown-unknown (-O cdylib, stripped)",
          "binarySizeBytes": 6110,
          "coldInstantiateMs": 0.0024,
          "warmExecutionMs": 0.86,
          "memoryPageCount": 1,
          "importsCount": 0,
          "exportsCount": 2,
          "notes": "no_std; unsafe slice views over the caller scratch buffer."
        },
        {
          "language": "Dart / WasmGC",
          "toolchain": "dart compile wasm (dart2wasm, Dart 3.12.2)",
          "binarySizeBytes": 44023,
          "coldInstantiateMs": 0.0892,
          "warmExecutionMs": 22.65,
          "memoryPageCount": 2,
          "importsCount": 396,
          "exportsCount": 9,
          "notes": "WasmGC; Uint32List views over zero-copy JS typed arrays — bit-identical output."
        }
      ]
    },
    {
      "name": "text-regex-log-scan",
      "description": "Log-scan pattern matcher over the 20 fixed SAFE_PATTERNS (url-tail/ipv4/status classes, first-byte dispatch) on a reduced 640-record corpus with 64 pattern events; 200 warm iterations. C/C++/Rust/Dart variants are bit-identical to the JS scanControlled oracle (matches + candidateStarts + prefixComparisons + tailComparisons, test-verified).",
      "variants": [
        {
          "language": "JavaScript",
          "toolchain": "V8 JIT Engine",
          "binarySizeBytes": 0,
          "coldInstantiateMs": 0,
          "warmExecutionMs": 73.52,
          "memoryPageCount": 0,
          "importsCount": 0,
          "exportsCount": 1,
          "notes": "Exact oracle semantics."
        },
        {
          "language": "C / Wasm",
          "toolchain": "LLVM Clang (-O3 -nostdlib)",
          "binarySizeBytes": 3972,
          "coldInstantiateMs": 0.002,
          "warmExecutionMs": 37.69,
          "memoryPageCount": 1,
          "importsCount": 0,
          "exportsCount": 2,
          "notes": "Linear memory; static pattern tables + caller scratch buckets."
        },
        {
          "language": "C++ / Wasm",
          "toolchain": "LLVM Clang++ (-O3 -nostdlib)",
          "binarySizeBytes": 3974,
          "coldInstantiateMs": 0.002,
          "warmExecutionMs": 36.65,